{
  "network": {
    "name": "Smith Family Network",
    "description": "Private family gossip network"
  },
  "nodes": [
    {
      "id": "node_01",
      "name": "Family Node 1"
    },
    {
      "id": "node_02",
      "name": "Family Node 2"
    },
    {
      "id": "node_03",
      "name": "Family Node 3"
    },
    {
      "id": "node_04",
      "name": "Family Node 4"
    }
  ],
  "users": {
    "admins": [
      {
        "id": "admin_001",
        "name": "John Smith",
        "role": "admin"
      },
      {
        "id": "admin_002",
        "name": "Jane Smith",
        "role": "admin"
      }
    ],
    "members": [
      {
        "id": "member_001",
        "name": "Emma Smith",
        "role": "member",
        "age": 12,
        "supervised_by": ["admin_001", "admin_002"]
      },
      {
        "id": "member_002", 
        "name": "Alex Smith",
        "role": "member",
        "age": 8,
        "supervised_by": ["admin_001", "admin_002"]
      }
    ]
  },
  "docker": {
    "mode": "production",
    "discovery": {
      "mode": "tailscale",
      "hostname_prefix": "tw_node"
    }
  }
} 